,Hotel_Title,Title_URL,Address,Address_URL,City,Review_Text,Price,Rating,State
336,Radisson (Formerly Protea Hotel Ikeja),https://hotels.ng/hotel/49583-protea-hotel-ikeja-lagos,"Ikeja, Lagos - 42/44 Isaac John Street, GRA",https://hotels.ng/hotels-in-lagos/ikeja,Ikeja,The hotel is good no doubt about that. Everything was really nice. The environment was cle...,74500.0,7.0,Lagos
337,Larex International Hotel,https://hotels.ng/hotel/65627-larex-international-hotel-lagos,"Yaba, Lagos - 75 Shipeolu Street Palmgroove",https://hotels.ng/hotels-in-lagos/yaba,Yaba,The hotel is a good place to be because I enjoyed my stay. The facilities and services at ...,5000.0,6.9,Lagos
339,Carat 24 Business Hotels ,https://hotels.ng/hotel/61628-carat-24-business-hotels-suites-lagos,"Festac, Lagos - Plot 1932 24 Road S Close",https://hotels.ng/hotels-in-lagos/festac,Festac," I had a splendid time at the hotel, the customer service was great. The room service was ...",10700.0,7.0,Lagos
341,"House 9 Royale, Ikeja",https://hotels.ng/hotel/1392964-house9-royale,"Ikeja, Lagos - 16, Ladipo Oluwole Street,  Off Adeniyi Jones Avenue, Ikeja",https://hotels.ng/hotels-in-lagos/ikeja,Ikeja,My stay was Wonderful....,17000.0,7.0,Lagos
342,Mobech Guest House Restaurant,https://hotels.ng/hotel/27174-mobech-guest-house-restaurant-lagos,"Yaba, Lagos - 1, Igbobisbe Street, Jibowu",https://hotels.ng/hotels-in-lagos/yaba,Yaba,My stay at the hotel was just alright. I had no issues and I enjoyed the services provided...,2500.0,7.0,Lagos
343,Virginrose Resorts,https://hotels.ng/hotel/61556-virginrose-resorts-lagos,"Victoria Island, Lagos - Plot 123LA Bishop Oluwole Street P.O Box 75647 ",https://hotels.ng/hotels-in-lagos/victoria-island,Victoria Island,"The place was very decent with 24 hours power supply, the food is nice and I enjoyed every...",21000.0,7.6,Lagos
344,Citi Lodge Hotel,https://hotels.ng/hotel/69617-citi-lodge-hotel-lagos,"Lekki, Lagos - 1, Goshen Estate Road, By Elf Bus Stop, Lekki-Epe Expressway, Lekki Peninsula",https://hotels.ng/hotels-in-lagos/lekki,Lekki,My stay was okay....,17000.0,6.6,Lagos
346,Esteem Royal Suites ,https://hotels.ng/hotel/15978-esteem-royal-suites-lagos,"Surulere, Lagos - 16, Ibudwu Street, Off Dire Road",https://hotels.ng/hotels-in-lagos/surulere,Surulere, I enjoyed all the services I paid for at this hotel. This is an experience I will love to...,8000.0,7.4,Lagos
347,Korona Suites,https://hotels.ng/hotel/66443-korona-suites-lagos,"Festac, Lagos - 41 Road, D1 Close, Opp All Saint Church, Festac. Close To Amuwo Odofin Local Govt ",https://hotels.ng/hotels-in-lagos/festac,Festac,I was not too impressed with the services I got at this hotel. The hotel was quiet and ser...,6000.0,7.0,Lagos
351,Opera Classic Suite Limited ,https://hotels.ng/hotel/73175-opera-classic-suite-limited-lagos,"Amuwo-Odofin, Lagos - Plot 102 Amuwo Odofin Festac Town Link",https://hotels.ng/hotels-in-lagos/amuwo-odofin,Amuwo-Odofin," I have been using the hotel for sometime now, I had a good stay. The hotel's service is r...",7000.0,6.2,Lagos
353,Jonesville Hotel ,https://hotels.ng/hotel/32526-jonesville-hotel-lagos,"Ebute Metta, Lagos - 234, Murtala Mohammed Way, Yaba",https://hotels.ng/hotels-in-lagos/ebute-metta,Ebute Metta,"My stay was awesome, the place is very conducive....",8000.0,7.9,Lagos
355,Big Fish Restaurant And Bar Surulere,https://hotels.ng/hotel/1391280-big-fish-restaurant-and-bar,"Surulere, Lagos - No 111 Bode Thomas Street, Surulere",https://hotels.ng/hotels-in-lagos/surulere,Surulere,Everything went so well. There was no complain at all....,7500.0,7.0,Lagos
357,D-ROCK-M HOTEL ,https://hotels.ng/hotel/1392175-d-rock-m-hotel,"Epe, Lagos - 1, Church Street, Imokun-Poka, Epe, Lagos, Epe, Lagos",https://hotels.ng/hotels-in-lagos/epe,Epe,Lovely hotel. Everything was on point....,6000.0,7.0,Lagos
358,Wendo Court Apartment,https://hotels.ng/hotel/1008004-wendo-court-apartment-lagos,"Lekki Phase 1, Lagos - 25, Daniyan Natalia Street Former Road 74 Off Oladimeji Alao Street ",https://hotels.ng/hotels-in-lagos/lekki-phase-1,Lekki Phase 1,"My stay at the hotel was not bad at all, the hotel's attendants were very nice and friendl...",25000.0,7.5,Lagos
362,BANEX HOTEL AND SUITES,https://hotels.ng/hotel/11266-banex-hotel-and-suites-lagos,"Maryland, Lagos - 60 Olorunlogbon Street,VOM Estate, Near Anthony Police Station Anthony, Maryland",https://hotels.ng/hotels-in-lagos/maryland,Maryland,"I enjoyed my stay at the hotel, the place was very nice and neat. The room was well furnis...",20000.0,7.7,Lagos
364,Reston Hotels Ltd,https://hotels.ng/hotel/98225-reston-hotels-ltd-lagos,"Ajao Estate, Lagos - 21 Fatai Irawo Street",https://hotels.ng/hotels-in-lagos/ajao-estate,Ajao Estate,I had a good stay at the hotel. The room and bathroom are clean and properly maintained. T...,13000.0,7.0,Lagos
365,Bogobiri House ,https://hotels.ng/hotel/95937-bogobiri-house-lagos,"Ikoyi, Lagos - 9 Maitama Sule Street Off Awolowo Road, South-West Ikoyi",https://hotels.ng/hotels-in-lagos/ikoyi,Ikoyi,My stay was pleasant....,33000.0,7.3,Lagos
366,Rexona Hotel,https://hotels.ng/hotel/83814-rexona-hotel-lagos,"Ojodu, Lagos - 12, Alhaji Bashir Street ",https://hotels.ng/hotels-in-lagos/ojodu,Ojodu,"My room was clean and comfortable,  customer service delivery was cool....",6600.0,7.0,Lagos
368,Newton Hotel,https://hotels.ng/hotel/34781-newton-hotel-lagos,"Festac, Lagos - Plot 628A First Avenue Junction.",https://hotels.ng/hotels-in-lagos/festac,Festac,My stay at the hotel was just fine. My check in and check out went well. The customer serv...,8500.0,6.2,Lagos
369,Three Arms Hotel,https://hotels.ng/hotel/44648-three-arms-hotel-lagos,"Ikoyi, Lagos - Plot 14 Royal Palm Drive, Osborne Estate Phase 2",https://hotels.ng/hotels-in-lagos/ikoyi,Ikoyi,I was able to check in early in the morning with no additional cost as was agreed previous...,27500.0,7.0,Lagos
370,Bakky Guest House,https://hotels.ng/hotel/42237-bakky-fasal-hotel-lagos,"Ketu, Lagos - Plot 7 Chief Bakky Avenue,Off Mr Biggs Ikosi Ketu.",https://hotels.ng/hotels-in-lagos/ketu,Ketu,I had a good stay at the hotel. The environment was peaceful and the structure of the hote...,5000.0,7.0,Lagos
371,Exquisite Suites And Conference Centre,https://hotels.ng/hotel/1006152-exquisite-suites-and-conference-centre-lagos,"Egbeda, Lagos - Plot 118, E Close, 3rd Avenue, Gowon Estate",https://hotels.ng/hotels-in-lagos/egbeda,Egbeda,My stay was fantastic....,16500.0,7.3,Lagos
373,Jaftel Hotels ,https://hotels.ng/hotel/1002084-jaftel-hotels-suites-lagos,"Ikorodu, Lagos - 35/37 Tinubu Estate Road,off Sagamu Road,Odogunyan Ikorodu",https://hotels.ng/hotels-in-lagos/ikorodu,Ikorodu,"I had an amazing stay, customer support was good....",5500.0,6.8,Lagos
377,Ostra Halls ,https://hotels.ng/hotel/49963-ostra-halls-and-hotel-lagos,"Ikeja, Lagos - Behind Mko Abiola Gardens, Opposite NNPC Gas Plant  Alausa Ikeja",https://hotels.ng/hotels-in-lagos/ikeja,Ikeja,I stayed at the hotel and I had a good time there. I had no issues checking in and out.I m...,15000.0,7.0,Lagos
378,Villa Toscana Hotels ,https://hotels.ng/hotel/1005196-villa-toscana-hotels-lagos,"Victoria Island, Lagos - 22 Oba Yusuf Way Oniru, ",https://hotels.ng/hotels-in-lagos/victoria-island,Victoria Island,I had a really great time at the hotel. The hotel is spacious with ample parking space. Th...,20000.0,7.0,Lagos
380,Duban International Hotels,https://hotels.ng/hotel/42992-duban-international-hotels-lagos,"Ikeja, Lagos - 63/65 Isheri Road",https://hotels.ng/hotels-in-lagos/ikeja,Ikeja,Duban international hotels should be rated 5 Stars already because the hotel's well equipp...,11050.0,7.5,Lagos
381,Moore Road Social,https://hotels.ng/hotel/75684-moore-road-social-lagos,"Yaba, Lagos - 28 Moore Road Off University Road",https://hotels.ng/hotels-in-lagos/yaba,Yaba,"This is not my first time staying in this hotel, I basically don't have anything to compla...",6000.0,7.0,Lagos
382,Lakeem Suites,https://hotels.ng/hotel/96267-lakeem-suites-lagos,"Ikoyi, Lagos - 16 Sunbo Jibowu Off Ribadu, Awolowo Road",https://hotels.ng/hotels-in-lagos/ikoyi,Ikoyi,"Your hotel was beyond my expectation, my stay  was superb. I enjoyed every bit of the hote...",20000.0,6.2,Lagos
385,Oyins Holiday Inn Limited ,https://hotels.ng/hotel/47718-oyins-holiday-inn-limited-lagos,"Ejigbo, Lagos - 32 Ajoke Kazeem Street Alake Bus-Stop Idimu Road",https://hotels.ng/hotels-in-lagos/ejigbo,Ejigbo,I had a good stay....,6500.0,7.0,Lagos
386,Hotel Paulson Plaza,https://hotels.ng/hotel/21784-hotel-paulson-plaza-lagos,"Ketu, Lagos - 8, Anibaba Street, Off Ikorodu Rd, Iyana School Bus Stop.",https://hotels.ng/hotels-in-lagos/ketu,Ketu,"For the past three days, my stay at hotel Paulson has been pleasant. The hotel environment...",7500.0,7.0,Lagos
387,Panorama Hotel & Restaurant,https://hotels.ng/hotel/1242740-panorama-hotel-restaurant,"Victoria Island, Lagos - 30 Oju Olobun Close",https://hotels.ng/hotels-in-lagos/victoria-island,Victoria Island,Comfortable and pleasant....,18800.0,7.0,Lagos
388,Sheraton Lagos Hotel,https://hotels.ng/hotel/53245-sheraton-lagos-hotel-lagos,"Ikeja, Lagos - 30 Mobolaji Bank Anthony Way, 21189 Airport Road",https://hotels.ng/hotels-in-lagos/ikeja,Ikeja,"My stay at Sheraton Lagos Hotel was a wonderful one, the hotel was easy to locate and the ...",72030.0,6.7,Lagos
389,The AHI Residence,https://hotels.ng/hotel/46236-the-ahi-residence-lagos,"Yaba, Lagos - 19 Lawal Street, Off Oweh Street, Jibowu",https://hotels.ng/hotels-in-lagos/yaba,Yaba,My stay at the hotel was very fine. No issues recorded at all. The room was clean and comf...,16500.0,6.0,Lagos
390,Inagbe Grand Resorts And Leisure,https://hotels.ng/hotel/1002490-inagbe-grand-resort-leisure-lagos,"Apapa, Lagos - Inagbe Island, Towards Snake Island, Along Apapa Port",https://hotels.ng/hotels-in-lagos/apapa,Apapa,The most disgusting and creepy place imaginable. I stayed here from the 22nd of December t...,36618.0,7.0,Lagos
391,The Dover Hotel,https://hotels.ng/hotel/96343-the-dover-hotel-lagos,"Lekki, Lagos - Plot 10 Road 16 Olubunmi Owa Street",https://hotels.ng/hotels-in-lagos/lekki,Lekki,"The food was really good, the rooms were spacious and clean. The hotel is well secured and...",27000.0,7.7,Lagos
398,Golden Palm Resort And Hotel,https://hotels.ng/hotel/52815-golden-palm-resort-and-hotel-lagos,"Lekki Phase 2, Lagos - No. 23 Platinum Way Off Lekki Epe Express, Jakande Between Femi Okunu And Nicon Town Estate Lekki Phase 1 ",https://hotels.ng/hotels-in-lagos/lekki-phase-2,Lekki Phase 2,"

My stay at the hotel was good, the hotel was beautiful and clean. I was given a warm r...",15000.0,6.8,Lagos
399,Ikeja Capital City Hotel,https://hotels.ng/hotel/31815-ikeja-capital-city-hotel-lagos,"Ikeja, Lagos - 50 Oba Akran Avenue",https://hotels.ng/hotels-in-lagos/ikeja,Ikeja,"Based on their rate, the hotel is okay. They staff were hospitable....",8000.0,7.0,Lagos
400,Aerol Hotel,https://hotels.ng/hotel/61726-aerol-hotel-lagos,"Okota, Lagos - 38-34 Olatunji Idowu Street Tarred Road B/Stop Off Ago Palace Way",https://hotels.ng/hotels-in-lagos/okota,Okota,Customer service was good. My room was clean. The only problem I had was the bathroom was ...,12500.0,7.0,Lagos
402,Ccise Court Hotel,https://hotels.ng/hotel/54635-ccise-court-hotel-lagos,"Ikeja, Lagos - 308 Titilayo Street Omole Phase 1",https://hotels.ng/hotels-in-lagos/ikeja,Ikeja,I had a good stay but there was no water in the bathroom and I had to wait for a very long...,9000.0,6.8,Lagos
405,Green House Hotel And Suites,https://hotels.ng/hotel/85982-green-house-hotel-and-suites-lagos,"Surulere, Lagos - 26, Adisa - Bashua Street, Off Adelabu Road, Masha, Surulere.",https://hotels.ng/hotels-in-lagos/surulere,Surulere," My stay at the hotel was awesome, I had a good time with  no stress.  I want thank  you H...",11250.0,7.0,Lagos
406,The Emperor Place,https://hotels.ng/hotel/1001887-mannase-homes-lagos,"Victoria Island, Lagos - Plot 900 Balarabe Musa Crescent Victoria Island Lagos , Victoria Island, Lagos",https://hotels.ng/hotels-in-lagos/victoria-island,Victoria Island,I had a good time at the hotel. I was warmly received by the staff and they were nice to m...,17500.0,7.0,Lagos
408,Arcadian Garden Hotel,https://hotels.ng/hotel/71371-arcadian-garden-hotel-lagos,"Maryland, Lagos -  5 Tinubu Road Palm Groove Estate",https://hotels.ng/hotels-in-lagos/maryland,Maryland,I will commend this hotel for their excellent customer service and well trained staff. The...,5000.0,7.0,Lagos
414,The Avenue Suites,https://hotels.ng/hotel/92856-the-avenue-suites-lagos,"Victoria Island, Lagos - 1390 Tiamiyu Savage Street, Off Ahmadu Bello Way",https://hotels.ng/hotels-in-lagos/victoria-island,Victoria Island, My stay was okay. My check in and check out of the hotel were seamless. The staff were po...,54000.0,7.0,Lagos
415,Savoy Suites ,https://hotels.ng/hotel/11928-savoy-suites-lagos,"Ikeja, Lagos - 43 Isaac John Street",https://hotels.ng/hotels-in-lagos/ikeja,Ikeja,"My stay was very enjoyable, everything was just perfect and I am glad I went there. My roo...",31500.0,7.0,Lagos
417,Sun On Hotel,https://hotels.ng/hotel/1005021-sun-on-hotel-lagos,"Ikeja, Lagos - 93B, Opebi Road, Ikeja, Lagos",https://hotels.ng/hotels-in-lagos/ikeja,Ikeja, I was satisfied with my stay at the hotel because everything went well. The staff were li...,13000.0,7.0,Lagos
418,The Nook Hotels,https://hotels.ng/hotel/1240280-the-nook-hotels,"Lekki, Lagos - 23B Fola Osibo Street,  Off Adebayo Doherty, Lekki Phase 1",https://hotels.ng/hotels-in-lagos/lekki,Lekki,I had a wonderful time here. Comfortable room with good service....,32000.0,7.0,Lagos
422,1st Delightsome House,https://hotels.ng/hotel/1010866-1st-delightsome-house,"Ikorodu, Lagos - 1 Delightsome House Street, Ijede Road, Surulere Bus Stop, Itamaga, Ikorodu",https://hotels.ng/hotels-in-lagos/ikorodu,Ikorodu,"My experience at the hotel was fine, I really liked my stay because the place was generall...",10200.0,7.0,Lagos
424,Zasarii Di Lusso,https://hotels.ng/hotel/41839-zasarii-di-lusso-lagos,"Lekki, Lagos - 13 Cornlius Odinjor Crescent, Off Hameed Kasumu Street Chevyview Estate Chevron Drive",https://hotels.ng/hotels-in-lagos/lekki,Lekki,"I really enjoyed my stay, coupled with the fact that the hotel was well secured and there ...",20000.0,7.4,Lagos
429,RONEKS ROYAL HOTELS & SUITES ,https://hotels.ng/hotel/1240417-ronek-royal-hotels,"Akowonjo, Lagos - No. 28 Olufemi Ojo Str By Shasha Road",https://hotels.ng/hotels-in-lagos/akowonjo,Akowonjo,"My room was very comfortable and clean, I must say this. The staffs were very accommodatin...",10000.0,7.0,Lagos
437,Protea Hotel Select Ikeja,https://hotels.ng/hotel/995174-protea-hotel-select-ikeja-lagos,"Ikeja, Lagos - Plot 2, Assbifi Road",https://hotels.ng/hotels-in-lagos/ikeja,Ikeja,My stay was very good at the hotel.I had no issues checking in and out of the place. The c...,72324.0,7.0,Lagos
438,Nostro Suites 1,https://hotels.ng/hotel/13639-nostro-suites-1-lagos,"Lekki, Lagos - Block 86 Plot 16A, Dr Adewale Oshin Street, Off Prince Bode Adebowola Crescent, Road 55A Via Fola Osibo",https://hotels.ng/hotels-in-lagos/lekki,Lekki,"My stay was not bad, there were no surprising factors but the hotel was pretty decent. The...",11500.0,7.4,Lagos
439,Kia And Testimony Hotel,https://hotels.ng/hotel/87897-kia-testimony-hotels-lagos,"Agege, Lagos - 7A Moses Emeya Close, Off Social Club Road, New Oko Oba Abule ",https://hotels.ng/hotels-in-lagos/agege,Agege,"My stay was short of beautiful, your hotel is passionate about giving their customer the b...",6000.0,7.0,Lagos
440,SOLITUDE HOTEL ,https://hotels.ng/hotel/87746-solitude-hotel-spa-lagos,"VICTORIA ISLAND , Lagos - 2 TY DANJUMA STREET OFF LIGALI AYORIDE VICTORIA ISLAND LAGOS",https://hotels.ng/hotels-in-lagos/victoria-island,VICTORIA ISLAND ,My stay was very short but nice. The few hours I spent was a good feeling of homeliness. C...,19688.0,7.0,Lagos
446,BWC Hotel ,https://hotels.ng/hotel/86625-best-western-the-island-hotel-lagos,"Victoria Island, Lagos - Plot 1228, Ahmadu Bello Way, Bar Beach",https://hotels.ng/hotels-in-lagos/victoria-island,Victoria Island,My stay at BWC Hotel went very well....,35750.0,7.0,Lagos
447,"Master Quality Inn, (Formerly Michael Lodge Nigeria)",https://hotels.ng/hotel/17822-michael-restaurant-nigeria-lagos,"Victoria Island, Lagos - Plot 1411 Adetokunbo Ademola Street",https://hotels.ng/hotels-in-lagos/victoria-island,Victoria Island,The hotel is neat and comfortable but they need more hands at the front desk....,20000.0,7.0,Lagos
448,JCB INN AND HALL,https://hotels.ng/hotel/56974-veneto-hotel-hall-limited-lagos,"Ojodu, Lagos - No 4, Noble Close, Omole Layout, Opposite NNPC Mega Filling Station By Hotel Bus Stop.",https://hotels.ng/hotels-in-lagos/ojodu,Ojodu,"Good stay, my stay was very fine, very good rooms, clean and comfortable. Very affordable....",9000.0,6.3,Lagos
450,Karma Hotel ,https://hotels.ng/hotel/71561-karma-hotel-restaurant-lagos,"Apapa, Lagos - 17 Burma Road",https://hotels.ng/hotels-in-lagos/apapa,Apapa,My stay at the hotel was so awesome. There was no reason to complain about anything. They ...,14460.0,7.0,Lagos
453,Richantonio Hotel,https://hotels.ng/hotel/68196-richanthonic-hotel-lagos,"Oshodi-Isolo, Lagos - 2 Richanthonic Suites Avenue By Olusesi Off Ibe Road Okota Round Abouts.",https://hotels.ng/hotels-in-lagos/oshodi-isolo,Oshodi-Isolo,My stay at the hotel was good. The hotel deserves more popularity than it currently has in...,8000.0,7.0,Lagos
457,Cameo's Suites ,https://hotels.ng/hotel/35924-cameos-suites-lagos,"Isolo, Lagos - 2 Ibe Road Beside Apatha Memorial Garden School Ireakari",https://hotels.ng/hotels-in-lagos/isolo,Isolo,Very nice hotel with the friendliest and most helpful staff I have ever met. I loved my st...,7000.0,7.0,Lagos
458,Bleu Ivy Hotel And Suites,https://hotels.ng/hotel/1000941-bleu-ivy-hotel-and-suites-lagos,"Ikeja, Lagos - 64,oduduwa Way, Off Isaac John Street, Ikeja G.R.A",https://hotels.ng/hotels-in-lagos/ikeja,Ikeja,The location of this hotel was perfect and the environment was very neat and conducive. Th...,18000.0,7.6,Lagos
459,FORT ROSS HOTEL AND EVENTS CENTRE,https://hotels.ng/hotel/1006086-fort-ross-hotel-and-events-centre-lagos,"Akowonjo, Lagos - 45 SHASHA ROAD AKOWONJO, ISHIWO BUS STOP",https://hotels.ng/hotels-in-lagos/akowonjo,Akowonjo,I will like to use this avenue to extol  Hotels.ng's good work. It's really laudable how m...,12000.0,7.0,Lagos
460,House B Guest Annex,https://hotels.ng/hotel/23347-house-b-guest-annex-lagos,"Magodo, Lagos - 34 Adeyemi Odukoya Street.",https://hotels.ng/hotels-in-lagos/magodo,Magodo,"Everything went well, my stay was good. ...",14500.0,7.0,Lagos
465,Mozzarella Hotels,https://hotels.ng/hotel/1005579-mozzarella-hotels-lagos,"Ipaja, Lagos - Plot 1, Salawu Giwa Street, Palace Road, Olorunjube Candos Avenue, Baruwa Ipaja ",https://hotels.ng/hotels-in-lagos/ipaja,Ipaja,"My stay went well, I give the hotel 8/10 rating. ...",4500.0,7.0,Lagos
468,RT 24 Hotel,https://hotels.ng/hotel/995689-rt-24-hotel-lagos,"Ikeja, Lagos - 24 Abiodun Sobajo Street, Off Bayo Ajayi Street, Agidingbi (Opp, Fela African Shrine), Agidingbi",https://hotels.ng/hotels-in-lagos/ikeja,Ikeja,"The room was spacious, neat, well arranged, a comfortable bed with nice fragrance emanatin...",10500.0,6.8,Lagos
470,Carliza Hotel ,https://hotels.ng/hotel/45722-carliza-hotel-lagos,"Apapa, Lagos - 3C Marine Road  By Liverpool",https://hotels.ng/hotels-in-lagos/apapa,Apapa,My stay was really fine. I gt to stay in the hotel for four days. The hotel provided good ...,25000.0,7.1,Lagos
479,Royal Emerald Hotel,https://hotels.ng/hotel/34475-royal-emerald-hotel-lagos,"Lekki, Lagos - 8, Harmony Crescent, Agungi",https://hotels.ng/hotels-in-lagos/lekki,Lekki,My stay was satisfactory....,12000.0,6.6,Lagos
485,Eagles Park 1960 Hotel,https://hotels.ng/hotel/79261-eagles-park-1960-hotel-lagos,"Ikeja, Lagos - 7, Obokun Close Off Dipeolu Street, Allen Junction, Awolowo Way",https://hotels.ng/hotels-in-lagos/ikeja,Ikeja,"The place was very nice, there was a flatscreen television, cable and internet connection....",13000.0,7.8,Lagos
486,Double A Suite And Lounge,https://hotels.ng/hotel/1008870-double-a-suite-and-lounge-lagos,"Lekki Phase 1, Lagos - 3 Gabby Adeosun Street Off Admiralty Way",https://hotels.ng/hotels-in-lagos/lekki-phase-1,Lekki Phase 1,My stay was smooth and peaceful. I was pleased with the facilities and services at the hot...,20000.0,7.3,Lagos
489,Zino Hotel International ,https://hotels.ng/hotel/49658-zino-hotel-international-lagos,"Badagry, Lagos - 42, Alhaji Sinatu Street, Agbara Bus Stop, Badagry Expressway, Badagry, Lagos",https://hotels.ng/hotels-in-lagos/badagry,Badagry,My stay was okay....,1900.0,7.0,Lagos
490,Westview Hotel,https://hotels.ng/hotel/1006405-westview-hotel-lagos,"Mafoluku, Lagos - 1 Sholanke Street, Mafoluku, Aiport Road",https://hotels.ng/hotels-in-lagos/mafoluku,Mafoluku,I was impressed with the services rendered at this hotel. It was more than satisfactory.  ...,18000.0,7.0,Lagos
496,Lagos Travel Inn,https://hotels.ng/hotel/77247-lagos-travel-inn-lagos,"Ikeja, Lagos - 39, Toyin Street",https://hotels.ng/hotels-in-lagos/ikeja,Ikeja,The hotel is a good place to be because I enjoyed my stay. The facilities and services at ...,19500.0,6.8,Lagos
500,De Oasis By Glinses Suites ,https://hotels.ng/hotel/14611-de-oasis-byglinses-suites-lodge-lagos,"Agbara, Lagos -  Plot C2/9A Ilaro Road, Agbara Industrial Estate",https://hotels.ng/hotels-in-lagos/agbara,Agbara,The hotel has improved generally since the last time I was there. They have really improve...,13000.0,6.9,Lagos
502,Seagul Hotel Limited,https://hotels.ng/hotel/15254-seagull-hotel-limited-lagos,"Isolo, Lagos - 13 Dele Ashiru Street Cresent Ire Akari Estate.",https://hotels.ng/hotels-in-lagos/isolo,Isolo,My stay was very okay....,6500.0,7.7,Lagos
503,INGLESIAS SUITES,https://hotels.ng/hotel/1012439-inglesias-suites-lagos,"Mushin , Lagos - 88, Akanro Street, Off Oshodi Apapa Expressway, IlasaMaja, Mushin Lagos State",https://hotels.ng/hotels-in-lagos/mushin,Mushin ,"My stay at the hotel was good and I really enjoyed it. Locating the hotel was quite easy, ...",9000.0,7.0,Lagos
507, Hotel 1960 (Prince Of Anthony),https://hotels.ng/hotel/13458-prince-of-anthony-lagos,"Anthony, Lagos - No. 27, Oyedele Oguniyi Street, ",https://hotels.ng/hotels-in-lagos/anthony,Anthony,I stayed a weekend at the hotel and it was wonderful. I was welcomed cheerfully by the sec...,10000.0,7.7,Lagos
509,Imperial Garden Hotel,https://hotels.ng/hotel/39715-imperial-garden-hotel-lagos,"Ikeja, Lagos - 44 Unity Road Off Mobolaji Bank Anthony Way ",https://hotels.ng/hotels-in-lagos/ikeja,Ikeja,"I spent a night at the hotel. The room was what I expected; beautiful, clean and a well dr...",8500.0,7.3,Lagos
511,Solab Hotels ,https://hotels.ng/hotel/69485-solab-hotels-suites-lagos,"Ikeja, Lagos - 1 Owodunni Street/Amore Street, Off Toyin Street",https://hotels.ng/hotels-in-lagos/ikeja,Ikeja,"I felt really glad about my experience at your hotel, It was beautiful and very comfortabl...",14000.0,7.0,Lagos
517,Terris Hotel ,https://hotels.ng/hotel/1003007-terris-hotel-suite-lagos,"Ogba, Lagos - 22B, Tunde Gabby Street, Behind County Hospital, By County Bus Stop",https://hotels.ng/hotels-in-lagos/ogba,Ogba,"A very good hotel in all aspects. Large room, quality fittings throughout and very comfort...",12000.0,7.0,Lagos
518,NSPRI GUEST HOUSE (ANNEX),https://hotels.ng/hotel/1002317-nspri-guest-house-annex-lagos,"Yaba, Lagos - 1, Harvey Rd,off Barikisu Iyede Street, By (Customs B/stop)Onitiri,Yaba,",https://hotels.ng/hotels-in-lagos/yaba,Yaba,"The room was very good and comfortable, it had in it a beautiful mirror, a television set ...",16500.0,7.0,Lagos
522,Rockview Hotel,https://hotels.ng/hotel/15898-rockview-hotel-lagos,"Festac, Lagos - Plot 33, 23 Road, 2nd Avenue ",https://hotels.ng/hotels-in-lagos/festac,Festac,The hotel was okay. It's a beautiful place and very nice too. All the complaints we made r...,13680.0,6.5,Lagos
528,Diamond Lodge Hotel ,https://hotels.ng/hotel/84546-diamond-lodge-hotel-lagos,"Surulere, Lagos - 12 Sabiu Ajose Street, Off Modupe Johnson",https://hotels.ng/hotels-in-lagos/surulere,Surulere,My stay at the hotel was good and pleasing. I was very comfortable in my room although it ...,5500.0,7.4,Lagos
533,Vic James Apartments,https://hotels.ng/hotel/15511-vic-james-apartments-lagos,"Festac, Lagos - 1, Alhaji Kuti Olayiwola Street, Diamond Estate",https://hotels.ng/hotels-in-lagos/festac,Festac,"I enjoyed my time at the hotel, it was lovely. I did not frolic at the hotel though, but I...",15000.0,6.8,Lagos
534,Bana Hotel And Suites,https://hotels.ng/hotel/1391660-bana-hotel-and-suites,"Apapa, Lagos - 176, Idewu Street, Olodi Apapa",https://hotels.ng/hotels-in-lagos/apapa,Apapa,"Perfect place to be, from the management to staff.  Well disciplined and organized staff. ...",11500.0,7.0,Lagos
536,Laviju Hotel And Suites,https://hotels.ng/hotel/1391693-laviju-hotel-and-suites,"Mushin, Lagos - 5, Cameroun Street,behind Area D Police Headquarters, Isolo Rd.",https://hotels.ng/hotels-in-lagos/mushin,Mushin,"I enjoyed my stay. The hotel is very nice, everything was in place for my comfort. I had n...",10500.0,7.0,Lagos
539,Haile Selassies Suite,https://hotels.ng/hotel/78232-haile-selassies-suite-lagos,"Surulere, Lagos - 60, Adetola Street.",https://hotels.ng/hotels-in-lagos/surulere,Surulere,"

My stay at the hotel was nice, the hotel was easy to locate. Their staff was respectfu...",11500.0,6.7,Lagos
540,Fbm Place Hotel,https://hotels.ng/hotel/44777-fmb-place-hotel-lagos,"Ikeja, Lagos - 14 Oshin Street Off Kudirat Abiola Way ",https://hotels.ng/hotels-in-lagos/ikeja,Ikeja,My stay at the hotel was not so bad. I always lodge there whenever I am in Lagos. The only...,12000.0,7.0,Lagos
